{
  "source_id": "hanlon-2025-jama",
  "title": "Effectiveness of glucose-lowering drugs in older adults with type 2 diabetes: a network meta-analysis",
  "doi": "10.1001/jama.2024.27402",
  "authors": [
    "Hanlon et al."
  ],
  "journal": "JAMA",
  "year": 2025,
  "domain": "biomedicine",
  "abstract": "Illustrative source metadata used for the Claims subnet RFC demo."
}
